PMID,Title,Authors,Citation,First Author,Journal/Book,Publication Year,Create Date,PMCID,NIHMS ID,DOI
37602417,MicroRNAs (miRNAs) and long non-coding RNAs (lncRNAs) in endometriosis - review of literature,"Szaflik T, Romanowicz H, Szyllo K, Smolarz B.",Ginekol Pol. 2023 Aug 21. doi: 10.5603/gpl.95968. Online ahead of print.,Szaflik T,Ginekol Pol,2023,2023/8/21,,,10.5603/gpl.95968
37495470,Exosomal microRNAs in tubal fluid may be involved in damage to tubal reproductive function associated with tubal endometriosis,"Zhang Y, Zhang H, Yan L, Liang G, Zhu C, Wang Y, Ji S, He C, Sun J, Zhang J.",Reprod Biomed Online. 2023 Jun 23:103249. doi: 10.1016/j.rbmo.2023.06.004. Online ahead of print.,Zhang Y,Reprod Biomed Online,2023,2023/7/26,,,10.1016/j.rbmo.2023.06.004
37480408,Exosomal microRNAs and long noncoding RNAs: as novel biomarkers for endometriosis,"Soltani-Fard E, Asadi M, Taghvimi S, Vafadar A, Vosough P, Tajbakhsh A, Savardashtaki A.",Cell Tissue Res. 2023 Jul 22. doi: 10.1007/s00441-023-03802-5. Online ahead of print.,Soltani-Fard E,Cell Tissue Res,2023,2023/7/22,,,10.1007/s00441-023-03802-5
37392565,Overexpression of lncRNA-MEG3 inhibits endometrial cell proliferation and invasion via miR-21-5p/DNMT3B/Twist,"Yang S, Feng L, Zhang Q, Wu L, Zhao Q, Hou Y, Yan B, Zhang S.",Clinics (Sao Paulo). 2023 Jun 29;78:100235. doi: 10.1016/j.clinsp.2023.100235. eCollection 2023.,Yang S,Clinics (Sao Paulo),2023,2023/7/1,,,10.1016/j.clinsp.2023.100235
37389684,TNFα-Induced Altered miRNA Expression Links to NF-κB Signaling Pathway in Endometriosis,"Banerjee S, Xu W, Doctor A, Driss A, Nezhat C, Sidell N, Taylor RN, Thompson WE, Chowdhury I.",Inflammation. 2023 Jun 30. doi: 10.1007/s10753-023-01862-x. Online ahead of print.,Banerjee S,Inflammation,2023,2023/6/30,,,10.1007/s10753-023-01862-x
37235907,Modulation of microRNAs expression and cellular signaling pathways through curcumin as a potential therapeutical approach against ovarian cancer: A review,"Moazzami B, Chaichian S, Nikfar B, Arbabi Bidgoli S.",Pathol Res Pract. 2023 Jul;247:154527. doi: 10.1016/j.prp.2023.154527. Epub 2023 May 8.,Moazzami B,Pathol Res Pract,2023,2023/5/26,,,10.1016/j.prp.2023.154527
37233993,A novel mechanism regulating pyroptosis-induced fibrosis in endometriosis via lnc-MALAT1/miR-141-3p/NLRP3 pathway†,"Xu Y, Liu H, Xiong W, Peng Y, Li X, Long X, Jin J, Liang J, Weng R, Liu J, Zhang L, Liu Y.",Biol Reprod. 2023 Aug 10;109(2):156-171. doi: 10.1093/biolre/ioad057.,Xu Y,Biol Reprod,2023,2023/5/26,,,10.1093/biolre/ioad057
37205467,TNFα-induced altered miRNA expression links to NF-κB signaling pathway in endometriosis,"Banerjee S, Xu W, Doctor A, Driss A, Nezhat C, Sidell N, Taylor RN, Thompson WE, Chowdhury I.",Res Sq. 2023 May 4:rs.3.rs-2870585. doi: 10.21203/rs.3.rs-2870585/v1. Preprint.,Banerjee S,Res Sq,2023,2023/5/19,PMC10187425,,10.21203/rs.3.rs-2870585/v1
37188982,MicroRNA-210-3p Regulates Endometriotic Lesion Development by Targeting IGFBP3 in Baboons and Women with Endometriosis,"Kai K, Joshi NR, Burns GW, Hrbek SM, Vegter EL, Ochoa-Bernal MA, Song Y, Moldovan GE, Sempere LF, Miyadahira EH, Serafini PC, Fazleabas AT.",Reprod Sci. 2023 May 15. doi: 10.1007/s43032-023-01253-5. Online ahead of print.,Kai K,Reprod Sci,2023,2023/5/15,,,10.1007/s43032-023-01253-5
37106834,Uterine Transcriptome: Understanding Physiology and Disease Processes,"Kirschen GW, Hessami K, AlAshqar A, Afrin S, Lulseged B, Borahay M.",Biology (Basel). 2023 Apr 21;12(4):634. doi: 10.3390/biology12040634.,Kirschen GW,Biology (Basel),2023,2023/4/28,PMC10136129,,10.3390/biology12040634
37071897,Targeting YAP1 ameliorates progesterone resistance in endometriosis,"Lin SC, Li WN, Lin SC, Hou HT, Tsai YC, Lin TC, Wu MH, Tsai SJ.",Hum Reprod. 2023 Jun 1;38(6):1124-1134. doi: 10.1093/humrep/dead071.,Lin SC,Hum Reprod,2023,2023/4/18,,,10.1093/humrep/dead071
37047609,"Assessment of BMP7, SMAD4, and CDH1 Expression Profile and Regulatory miRNA-542-3p in Eutopic and Ectopic Endometrium of Women with Endometriosis","Zubrzycka A, Migdalska-Sęk M, Jędrzejczyk S, Brzeziańska-Lasota E.",Int J Mol Sci. 2023 Apr 2;24(7):6637. doi: 10.3390/ijms24076637.,Zubrzycka A,Int J Mol Sci,2023,2023/4/13,PMC10095043,,10.3390/ijms24076637
37047088,Liquid Biopsy in Endometriosis: A Systematic Review,"Ronsini C, Fumiento P, Iavarone I, Greco PF, Cobellis L, De Franciscis P.",Int J Mol Sci. 2023 Mar 24;24(7):6116. doi: 10.3390/ijms24076116.,Ronsini C,Int J Mol Sci,2023,2023/4/13,PMC10094565,,10.3390/ijms24076116
37023661,circPLOD2 knockdown suppresses endometriosis progression via the miR-216a-5p/ZEB1 axis,"Lai G, Bu D, Chen M, Liu H, Dong L.",Reprod Biol. 2023 Jun;23(2):100758. doi: 10.1016/j.repbio.2023.100758. Epub 2023 Apr 4.,Lai G,Reprod Biol,2023,2023/4/6,,,10.1016/j.repbio.2023.100758
37017808,Upregulation of HTRA1 mediated by the lncRNA NEAT1/miR-141-3p axis contributes to endometriosis development through activating NLRP3 inflammasome-mediated pyroptotic cell death and cellular inflammation,"Li L, Ye K, Wang D.",In Vitro Cell Dev Biol Anim. 2023 Mar;59(3):166-178. doi: 10.1007/s11626-023-00760-8. Epub 2023 Apr 5.,Li L,In Vitro Cell Dev Biol Anim,2023,2023/4/5,,,10.1007/s11626-023-00760-8
36983035,Downregulation of DROSHA: Could It Affect miRNA Biogenesis in Endometriotic Menstrual Blood Mesenchymal Stem Cells?,"Cressoni ACL, Penariol LBC, Padovan CC, Orellana MD, Rosa-E-Silva JC, Poli-Neto OB, Ferriani RA, de Paz CCP, Meola J.",Int J Mol Sci. 2023 Mar 22;24(6):5963. doi: 10.3390/ijms24065963.,Cressoni ACL,Int J Mol Sci,2023,2023/3/29,PMC10057010,,10.3390/ijms24065963
36979365,Towards a Better Understanding of Endometriosis-Related Infertility: A Review on How Endometriosis Affects Endometrial Receptivity,"Shan J, Li DJ, Wang XQ.",Biomolecules. 2023 Feb 24;13(3):430. doi: 10.3390/biom13030430.,Shan J,Biomolecules,2023,2023/3/29,PMC10046640,,10.3390/biom13030430
36915057,PCGEM1 promotes cell proliferation and migration in endometriosis by targeting miR-124-3p-mediated ANTXR2 expression,"Liu Y, Xie C, Li T, Lu C, Fan L, Zhang Z, Peng S, Lv N, Lu D.",BMC Womens Health. 2023 Mar 13;23(1):104. doi: 10.1186/s12905-023-02250-1.,Liu Y,BMC Womens Health,2023,2023/3/14,PMC10012497,,10.1186/s12905-023-02250-1
36901866,Altered Differential Expression of Genes and microRNAs Related to Adhesion and Apoptosis Pathways in Patients with Different Phenotypes of Endometriosis,"Antonio LGL, Meola J, Rosa-E-Silva ACJS, Nogueira AA, Candido Dos Reis FJ, Poli-Neto OB, Rosa-E-Silva JC.",Int J Mol Sci. 2023 Feb 23;24(5):4434. doi: 10.3390/ijms24054434.,Antonio LGL,Int J Mol Sci,2023,2023/3/11,PMC10002379,,10.3390/ijms24054434
36868502,"Evaluation of expression of biomarkers of PLAGL1 (ZAC1), microRNA, and their non-coding RNAs in patients with endometriosis","Tahermanesh K, Hakimpour S, Govahi A, Rokhgireh S, Mehdizadeh M, Minaeian S, Barati M, Chaichian S, Kashi AM, Nassiri S, Eslahi N, Ajdary M, Ahmadi M.",J Gynecol Obstet Hum Reprod. 2023 Apr;52(4):102568. doi: 10.1016/j.jogoh.2023.102568. Epub 2023 Mar 2.,Tahermanesh K,J Gynecol Obstet Hum Reprod,2023,2023/3/3,,,10.1016/j.jogoh.2023.102568
36768775,"The Expression of TGF-β1, SMAD3, ILK and miRNA-21 in the Ectopic and Eutopic Endometrium of Women with Endometriosis","Zubrzycka A, Migdalska-Sęk M, Jędrzejczyk S, Brzeziańska-Lasota E.",Int J Mol Sci. 2023 Jan 26;24(3):2453. doi: 10.3390/ijms24032453.,Zubrzycka A,Int J Mol Sci,2023,2023/2/11,PMC9917033,,10.3390/ijms24032453
36751747,"Role of serum microRNAs as biomarkers for endometriosis, endometrioid carcinoma of ovary & endometrioid endometrial cancer","Kumari P, Sharma I, Saha SC, Srinivasan R, Bhardwaj P.",Indian J Med Res. 2022 Sep;156(3):516-523. doi: 10.4103/ijmr.IJMR_288_20.,Kumari P,Indian J Med Res,2022,2023/2/8,PMC10101355,,10.4103/ijmr.IJMR_288_20
36650372,MicroRNA-92a-3p Inhibits Cell Proliferation and Invasion by Regulating the Transcription Factor 21/Steroidogenic Factor 1 Axis in Endometriosis,"Zhu J, Xu Z, Wu P, Zeng C, Peng C, Zhou Y, Xue Q.",Reprod Sci. 2023 Jul;30(7):2188-2197. doi: 10.1007/s43032-021-00734-9. Epub 2023 Jan 17.,Zhu J,Reprod Sci,2023,2023/1/17,PMC10310800,,10.1007/s43032-021-00734-9
36622742,CDKN2B-AS1 is overexpressed in polycystic ovary syndrome and sponges miR-181a to promote granulosa cell proliferation,"Huang Y, Zhang Y, Zhou Y, Chen Y, Zhu Q.",Anticancer Drugs. 2023 Feb 1;34(2):207-213. doi: 10.1097/CAD.0000000000001405. Epub 2023 Oct 24.,Huang Y,Anticancer Drugs,2023,2023/1/9,PMC9815812,,10.1097/CAD.0000000000001405
36617199,Down-Regulation of miR-93 Negatively Correlates with Overexpression of VEGFA and MMP3 in Endometriosis: A Cross-Sectional Study,"Muharam R, Rahmala Febri R, Mutia K, Iffanolida PA, Maidarti M, Wiweko B, Hestiantoro A.",Int J Fertil Steril. 2023 Jan 1;17(1):28-33. doi: 10.22074/ijfs.2022.543884.1233.,Muharam R,Int J Fertil Steril,2023,2023/1/8,PMC9807893,,10.22074/ijfs.2022.543884.1233
36597409,Exosomal miR-202 derived from leukorrhea as a potential biomarker for endometriosis,"Zheng L, Sun DF, Tong Y.",J Int Med Res. 2023 Jan;51(1):3000605221147183. doi: 10.1177/03000605221147183.,Zheng L,J Int Med Res,2023,2023/1/4,PMC9830089,,10.1177/03000605221147183
36572643,miR-297 inhibits expression of progesterone receptor and decidualization in eutopic endometria of endometriosis,"Liu T, Xiao L, Pei T, Luo B, Tan J, Long Y, Huang X, Ouyang Y, Huang W.",J Obstet Gynaecol Res. 2023 Mar;49(3):956-965. doi: 10.1111/jog.15526. Epub 2022 Dec 26.,Liu T,J Obstet Gynaecol Res,2023,2022/12/26,,,10.1111/jog.15526
36551866,Exosomes from the Uterine Cavity Mediate Immune Dysregulation via Inhibiting the JNK Signal Pathway in Endometriosis,"Jiang Y, Chai X, Chen S, Chen Z, Tian H, Liu M, Wu X.",Biomedicines. 2022 Dec 2;10(12):3110. doi: 10.3390/biomedicines10123110.,Jiang Y,Biomedicines,2022,2022/12/23,PMC9775046,,10.3390/biomedicines10123110
36546578,"METTL3 is aberrantly expressed in endometriosis and suppresses proliferation, invasion, and migration of endometrial stromal cells",Zhang QC.,Kaohsiung J Med Sci. 2023 Mar;39(3):266-277. doi: 10.1002/kjm2.12626. Epub 2022 Dec 22.,Zhang QC,Kaohsiung J Med Sci,2023,2022/12/22,,,10.1002/kjm2.12626
36508036,LncRNA IGF2-AS promotes endometriosis progression through targeting miR-370-3p/IGF2 axis and activating PI3K/AKT/mTOR signaling pathway,"Jin X, Feng J, Cheng X.",J Assist Reprod Genet. 2022 Dec;39(12):2699-2710. doi: 10.1007/s10815-022-02638-2. Epub 2022 Dec 12.,Jin X,J Assist Reprod Genet,2022,2022/12/12,PMC9790843,,10.1007/s10815-022-02638-2
36427469,Knockdown of miR-150-5p reduces hypoxia-induced autophagy and epithelial-mesenchymal transition of endometriotic cells via regulating the PDCD4/NF-κB signaling pathway,"Chen ML, Fan L, Huang GR, Sun ZF.",Cytokine. 2023 Feb;162:156086. doi: 10.1016/j.cyto.2022.156086. Epub 2022 Nov 22.,Chen ML,Cytokine,2023,2022/11/25,,,10.1016/j.cyto.2022.156086
36424910,Saliva microRNA signature to diagnose endometriosis: A cost-effectiveness evaluation of the Endotest®,"Ferrier C, Bendifallah S, Suisse S, Dabi Y, Touboul C, Puchar A, Zarca K, Durand Zaleski I.",BJOG. 2023 Mar;130(4):396-406. doi: 10.1111/1471-0528.17348. Epub 2022 Dec 19.,Ferrier C,BJOG,2023,2022/11/25,,,10.1111/1471-0528.17348
36423858,microRNA-100 shuttled by human umbilical cord MSC-secreted extracellular vesicles induces endometriosis by inhibiting HS3ST2,"Zhang F, Li F, Lu J.",Cell Signal. 2023 Feb;102:110532. doi: 10.1016/j.cellsig.2022.110532. Epub 2022 Nov 22.,Zhang F,Cell Signal,2023,2022/11/24,,,10.1016/j.cellsig.2022.110532
36411203,Endometriosis-associated infertility diagnosis based on saliva microRNA signatures,"Dabi Y, Suisse S, Puchar A, Delbos L, Poilblanc M, Descamps P, Haury J, Golfier F, Jornea L, Bouteiller D, Touboul C, Daraï E, Bendifallah S.",Reprod Biomed Online. 2023 Jan;46(1):138-149. doi: 10.1016/j.rbmo.2022.09.019. Epub 2022 Sep 27.,Dabi Y,Reprod Biomed Online,2023,2022/11/21,,,10.1016/j.rbmo.2022.09.019
36381355,Metformin as a potential agent for modulating the faulty endometriotic mesenchymal stem cells: A case-control study,"Mashayekhi P, Noruzinia M, Khodaverdi S.",Int J Reprod Biomed. 2022 Nov 2;20(10):861-872. doi: 10.18502/ijrm.v20i10.12270. eCollection 2022 Oct.,Mashayekhi P,Int J Reprod Biomed,2022,2022/11/16,PMC9644643,,10.18502/ijrm.v20i10.12270
36377220,Effect of PLGA Nanoparticle-Mediated Delivery of miRNA 503 on The Apoptosis of Ovarian Endometriosis Cells,"Chaichian S, Mehdizadeh Kashi A, Tehermanesh K, Pirhajati Mahabadi V, Minaeian S, Eslahi N.",Cell J. 2022 Nov 2;24(11):697-704. doi: 10.22074/cellj.2022.557554.1069.,Chaichian S,Cell J,2022,2022/11/15,PMC9663963,,10.22074/cellj.2022.557554.1069
36375526,Non-invasive diagnosis of endometriosis: Immunologic and genetic markers,"Moein Mahini S, Younesi M, Mortazavi G, Samare-Najaf M, Karim Azadbakht M, Jamali N.",Clin Chim Acta. 2023 Jan 1;538:70-86. doi: 10.1016/j.cca.2022.11.013. Epub 2022 Nov 12.,Moein Mahini S,Clin Chim Acta,2023,2022/11/14,,,10.1016/j.cca.2022.11.013
36355359,Role of ceRNAs in non-tumor female reproductive diseases†,"Yang Y, Xiong Y, Pan Z.",Biol Reprod. 2023 Mar 13;108(3):363-381. doi: 10.1093/biolre/ioac200.,Yang Y,Biol Reprod,2023,2022/11/10,,,10.1093/biolre/ioac200
36289820,MicroRNAs Dysregulation as Potential Biomarkers for Early Diagnosis of Endometriosis,"Ghasemi F, Alemzadeh E, Allahqoli L, Alemzadeh E, Mazidimoradi A, Salehiniya H, Alkatout I.",Biomedicines. 2022 Oct 13;10(10):2558. doi: 10.3390/biomedicines10102558.,Ghasemi F,Biomedicines,2022,2022/10/27,PMC9599310,,10.3390/biomedicines10102558
36281935,Long non‑coding RNA LINC01960‑201 hinders decidualization of endometrial stromal cell in endometriosis: Relevance to endometrial receptivity,"Cai H, Lang J.",Mol Med Rep. 2022 Dec;26(6):366. doi: 10.3892/mmr.2022.12883. Epub 2022 Oct 25.,Cai H,Mol Med Rep,2022,2022/10/25,,,10.3892/mmr.2022.12883
36263059,Deficiency of MST1 in endometriosis related peritoneal macrophages promoted the autophagy of ectopic endometrial stromal cells by IL-10,"Huang Y, Yan S, Dong X, Jiao X, Wang S, Li D, Wang G.",Front Immunol. 2022 Oct 3;13:993788. doi: 10.3389/fimmu.2022.993788. eCollection 2022.,Huang Y,Front Immunol,2022,2022/10/20,PMC9575673,,10.3389/fimmu.2022.993788
36262826,LncRNA BANCR Promotes Endometrial Stromal Cell Proliferation and Invasion in Endometriosis via the miR-15a-5p/TRIM59 Axis,"Liu L, Bai R, Li D, Dai B, Tuo Y.",Int J Genomics. 2022 Oct 10;2022:9083822. doi: 10.1155/2022/9083822. eCollection 2022.,Liu L,Int J Genomics,2022,2022/10/20,PMC9576446,,10.1155/2022/9083822
36244127,miRNA-223 expression in patient-derived eutopic and ectopic endometrial stromal cells and its effect on epithelial-to-mesenchymal transition in endometriosis,"Xue Y, Lin X, Shi T, Tian Y.",Clinics (Sao Paulo). 2022 Oct 13;77:100112. doi: 10.1016/j.clinsp.2022.100112. eCollection 2022.,Xue Y,Clinics (Sao Paulo),2022,2022/10/16,PMC9579502,,10.1016/j.clinsp.2022.100112
36212136,Identification of functional TF-miRNA-hub gene regulatory network associated with ovarian endometriosis,"Li L, Sun B, Sun Y.",Front Genet. 2022 Sep 20;13:998417. doi: 10.3389/fgene.2022.998417. eCollection 2022.,Li L,Front Genet,2022,2022/10/10,PMC9540245,,10.3389/fgene.2022.998417
36191723,"Regulation of progesterone receptor expression in endometriosis, endometrial cancer, and breast cancer by estrogen, polymorphisms, transcription factors, epigenetic alterations, and ubiquitin-proteasome system","Pu H, Wen X, Luo D, Guo Z.",J Steroid Biochem Mol Biol. 2023 Mar;227:106199. doi: 10.1016/j.jsbmb.2022.106199. Epub 2022 Sep 30.,Pu H,J Steroid Biochem Mol Biol,2023,2022/10/3,,,10.1016/j.jsbmb.2022.106199
36165640,Integrated analysis identified novel miRNAs and mRNA in endometriosis,"Ma H, Sun X, Wang Y, Tian H, Lao K, Yan J, Diao X.",Ginekol Pol. 2022 Sep 27. doi: 10.5603/GP.a2022.0078. Online ahead of print.,Ma H,Ginekol Pol,2022,2022/9/27,,,10.5603/GP.a2022.0078
36147505,A review on the importance of miRNA-135 in human diseases,"Kadkhoda S, Eslami S, Mahmud Hussen B, Ghafouri-Fard S.",Front Genet. 2022 Sep 6;13:973585. doi: 10.3389/fgene.2022.973585. eCollection 2022.,Kadkhoda S,Front Genet,2022,2022/9/23,PMC9486161,,10.3389/fgene.2022.973585
36143357,Roles of microRNAs in Regulating Apoptosis in the Pathogenesis of Endometriosis,"Azam INA, Wahab NA, Mokhtar MH, Shafiee MN, Mokhtar NM.",Life (Basel). 2022 Aug 26;12(9):1321. doi: 10.3390/life12091321.,Azam INA,Life (Basel),2022,2022/9/23,PMC9500848,,10.3390/life12091321
36044630,Rhein inhibits endometriosis by targeting microRNA-135,"Dan W, En Jing Z, Juan J, Yi Y, Yi Ling J.",Acta Biochim Pol. 2022 Aug 31;69(3):593-597. doi: 10.18388/abp.2020_5935.,Dan W,Acta Biochim Pol,2022,2022/8/31,,,10.18388/abp.2020_5935
36009038,Hsa-mir-135a Shows Potential as A Putative Diagnostic Biomarker in Saliva and Plasma for Endometriosis,"Perricos A, Proestling K, Husslein H, Kuessel L, Hudson QJ, Wenzl R, Yotova I.",Biomolecules. 2022 Aug 19;12(8):1144. doi: 10.3390/biom12081144.,Perricos A,Biomolecules,2022,2022/8/26,PMC9405570,,10.3390/biom12081144
35996508,"MicroRNA Variants miR-27a rs895819 and miR-423 rs6505162, but not miR-124-1 rs531564, are Linked to Endometriosis and its Severity","Jaafar SO, Jaffar JO, Ibrahim SA, Jarjees KK.",Br J Biomed Sci. 2022 Jan 7;79:10207. doi: 10.3389/bjbs.2021.10207. eCollection 2022.,Jaafar SO,Br J Biomed Sci,2022,2022/8/23,PMC8915672,,10.3389/bjbs.2021.10207
35985520,Identification of potential repurposed drugs for treating endometriosis-associated infertility among women,"Nayak R, Chattopadhyay T, Mallick B.",Chem Biol Interact. 2022 Sep 25;365:110110. doi: 10.1016/j.cbi.2022.110110. Epub 2022 Aug 17.,Nayak R,Chem Biol Interact,2022,2022/8/19,,,10.1016/j.cbi.2022.110110
35984026,The Use of Machine Learning in MicroRNA Diagnostics: Current Perspectives,"Christou CD, Mitsas AC, Vlachavas I, Tsoulfas G.",Microrna. 2022;11(3):175-184. doi: 10.2174/2211536611666220818145553.,Christou CD,Microrna,2022,2022/8/19,,,10.2174/2211536611666220818145553
35977804,Identification of miR-34-3p as a candidate follicular phase serum marker for endometriosis: a pilot study,"Neuhausser WM, Faure-Kumar E, Mahurkar-Joshi S, Iliopoulos D, Sakkas D.",F S Sci. 2022 Aug;3(3):269-278. doi: 10.1016/j.xfss.2022.02.005. Epub 2022 Feb 18.,Neuhausser WM,F S Sci,2022,2022/8/17,,,10.1016/j.xfss.2022.02.005
35970002,Evaluation of the relationship between miR-1271 and GRB2 gene in endometriosis,"Yarahmadi G, Fazeli J, Dehghanian M, Mehrjardi MYV, Javaheri A, Kalantar SM.",Eur J Obstet Gynecol Reprod Biol. 2022 Oct;277:12-15. doi: 10.1016/j.ejogrb.2022.08.007. Epub 2022 Aug 11.,Yarahmadi G,Eur J Obstet Gynecol Reprod Biol,2022,2022/8/15,,,10.1016/j.ejogrb.2022.08.007
35944745,Effects of selective inhibition of prostaglandin E2 receptors EP2 and EP4 on the miRNA profile in endometriosis,"Arosh JA, Sivakumar KK, Lee J, Banu SK.",Mol Cell Endocrinol. 2022 Dec 1;558:111728. doi: 10.1016/j.mce.2022.111728. Epub 2022 Aug 6.,Arosh JA,Mol Cell Endocrinol,2022,2022/8/9,,,10.1016/j.mce.2022.111728
35902026,Overexpressed miR-106b-5p promotes epithelial-mesenchymal transition in endometriosis by targeting PTEN,"Hu F, Wang Y, Wu X, Liu S, Ren H, Zhou W.",Reprod Toxicol. 2022 Oct;113:62-70. doi: 10.1016/j.reprotox.2022.07.007. Epub 2022 Jul 25.,Hu F,Reprod Toxicol,2022,2022/7/28,,,10.1016/j.reprotox.2022.07.007
35901619,MALAT1 accelerates proliferation and inflammation and suppresses apoptosis of endometrial stromal cells via the microRNA-142-3p/CXCR7 axis,"Tan K, Mo H, Guo L, Wang B.",Reprod Biol. 2022 Sep;22(3):100675. doi: 10.1016/j.repbio.2022.100675. Epub 2022 Jul 25.,Tan K,Reprod Biol,2022,2022/7/28,,,10.1016/j.repbio.2022.100675
35901079,"Genetic variations in UCA1, a lncRNA functioning as a miRNA sponge, determine endometriosis development and the potential associated infertility via regulating lipogenesis","Chang CY, Yang L, Tse J, Lo LC, Tseng CC, Sun L, Lai MT, Chen PH, Hwang T, Chen CM, Tsai FJ, Sheu JJ.",PLoS One. 2022 Jul 28;17(7):e0271616. doi: 10.1371/journal.pone.0271616. eCollection 2022.,Chang CY,PLoS One,2022,2022/7/28,PMC9333278,,10.1371/journal.pone.0271616
35895963,Endometriosis biomarkers of the disease: an update,"Encalada Soto D, Rassier S, Green IC, Burnett T, Khan Z, Cope A.",Curr Opin Obstet Gynecol. 2022 Aug 1;34(4):210-219. doi: 10.1097/GCO.0000000000000798.,Encalada Soto D,Curr Opin Obstet Gynecol,2022,2022/7/27,,,10.1097/GCO.0000000000000798
35887822,Pathogenesis of Human Adenomyosis: Current Understanding and Its Association with Infertility,"Khan KN, Fujishita A, Mori T.",J Clin Med. 2022 Jul 13;11(14):4057. doi: 10.3390/jcm11144057.,Khan KN,J Clin Med,2022,2022/7/27,PMC9316454,,10.3390/jcm11144057
35887388,A Bioinformatics Approach to MicroRNA-Sequencing Analysis Based on Human Saliva Samples of Patients with Endometriosis,"Bendifallah S, Dabi Y, Suisse S, Jornea L, Bouteiller D, Touboul C, Puchar A, Daraï E.",Int J Mol Sci. 2022 Jul 21;23(14):8045. doi: 10.3390/ijms23148045.,Bendifallah S,Int J Mol Sci,2022,2022/7/27,PMC9317484,,10.3390/ijms23148045
35876135,Integrated bioinformatic analysis of dysregulated microRNA-mRNA co-expression network in ovarian endometriosis,"Liu Y, Fan L, Jin L, Lu C, Li T, Zhang Z, Xie C, Li S, Zhang Y, Ren J, Lu D.",Acta Obstet Gynecol Scand. 2022 Oct;101(10):1074-1084. doi: 10.1111/aogs.14430. Epub 2022 Jul 25.,Liu Y,Acta Obstet Gynecol Scand,2022,2022/7/25,PMC9812100,,10.1111/aogs.14430
35799021,"mRNA, lncRNA and Circular RNA Expression Profiles in Granulosa Cells of Infertile Women with Ovarian Endometriosis","Guo J, Zeng H, Li T, Liang X, Peng J.",Reprod Sci. 2022 Oct;29(10):2937-2946. doi: 10.1007/s43032-022-00966-3. Epub 2022 Jul 7.,Guo J,Reprod Sci,2022,2022/7/7,,,10.1007/s43032-022-00966-3
35796227,Anti-oxidant effect of metformin through AMPK/SIRT1/PGC-1α/SIRT3- independent GPx1 expression in the heart of mice with endometriosis,"Felgueiras R, Neto AC, Rodrigues AR, Gouveia AM, Almeida H, Neves D.",Horm Mol Biol Clin Investig. 2022 Jul 7;43(4):405-414. doi: 10.1515/hmbci-2022-0039. eCollection 2022 Dec 1.,Felgueiras R,Horm Mol Biol Clin Investig,2022,2022/7/7,,,10.1515/hmbci-2022-0039
35717759,"Circ_0004712 promotes endometriotic epithelial cell proliferation, migration and invasion by regulating miR-488-3p/ROCK1 axis in vitro","Xu K, Chen Y, Li S, Chen L, Huang X.",Reprod Biol. 2022 Sep;22(3):100667. doi: 10.1016/j.repbio.2022.100667. Epub 2022 Jun 17.,Xu K,Reprod Biol,2022,2022/6/19,,,10.1016/j.repbio.2022.100667
35708784,"Silencing of circ_0007299 suppresses proliferation, migration, and invasiveness and promotes apoptosis of ectopic endometrial stromal cells in endometriosis via miR-424-5p-dependent modulation of CREB1","Mao H, Zhang X, Yin L, Ji X, Huang C, Wu Q.",Arch Gynecol Obstet. 2023 Jan;307(1):149-161. doi: 10.1007/s00404-022-06650-w. Epub 2022 Jun 16.,Mao H,Arch Gynecol Obstet,2023,2022/6/16,,,10.1007/s00404-022-06650-w
35682889,MicroRNAs in the Regulation of Endometrial Receptivity for Embryo Implantation,"Shekibi M, Heng S, Nie G.",Int J Mol Sci. 2022 Jun 1;23(11):6210. doi: 10.3390/ijms23116210.,Shekibi M,Int J Mol Sci,2022,2022/6/10,PMC9181585,,10.3390/ijms23116210
35682544,"The Relationship and Expression of miR-451a, miR-25-3p and PTEN in Early Peritoneal Endometriotic Lesions and Their Modulation In Vitro","Nothnick WB, Peterson R, Minchella P, Falcone T, Graham A, Findley A.",Int J Mol Sci. 2022 May 24;23(11):5862. doi: 10.3390/ijms23115862.,Nothnick WB,Int J Mol Sci,2022,2022/6/10,PMC9180609,,10.3390/ijms23115862
35601407,Exploration of the Shared Gene and Molecular Mechanisms Between Endometriosis and Recurrent Pregnancy Loss,"Ye Z, Meng Q, Zhang W, He J, Zhao H, Yu C, Liang W, Li X, Wang H.",Front Vet Sci. 2022 May 6;9:867405. doi: 10.3389/fvets.2022.867405. eCollection 2022.,Ye Z,Front Vet Sci,2022,2022/5/23,PMC9120926,,10.3389/fvets.2022.867405
35587747,"miR-203a-3p, ABL1 and TP63 gene expression is altered in the endometrium of women with endometriosis","Pashaei M, Mashayekhi F, Zahiri Z, Salehi Z.",Gynecol Endocrinol. 2022 Jul;38(7):603-607. doi: 10.1080/09513590.2022.2076830. Epub 2022 May 19.,Pashaei M,Gynecol Endocrinol,2022,2022/5/19,,,10.1080/09513590.2022.2076830
35563053,miR 31-3p Has the Highest Expression in Cesarean Scar Endometriosis,"Szubert M, Nowak-Glück A, Domańska-Senderowska D, Szymańska B, Sowa P, Rycerz A, Wilczyński JR.",Int J Mol Sci. 2022 Apr 22;23(9):4660. doi: 10.3390/ijms23094660.,Szubert M,Int J Mol Sci,2022,2022/5/14,PMC9105608,,10.3390/ijms23094660
35560017,Methylation of microribonucleic acid Let-7b regulatory regions in endometriosis,"Meixell DA, Mamillapalli R, Taylor HS.",F S Sci. 2022 May;3(2):197-203. doi: 10.1016/j.xfss.2022.03.001. Epub 2022 Mar 30.,Meixell DA,F S Sci,2022,2022/5/13,,,10.1016/j.xfss.2022.03.001
35513844,"Exosomal AFAP1-AS1 binds to microRNA-15a-5p to promote the proliferation, migration, and invasion of ectopic endometrial stromal cells in endometriosis","Wang X, Zhang M, Jiang L, Fang X, Zhang T.",Reprod Biol Endocrinol. 2022 May 5;20(1):77. doi: 10.1186/s12958-022-00942-1.,Wang X,Reprod Biol Endocrinol,2022,2022/5/5,PMC9069797,,10.1186/s12958-022-00942-1
35504053,CircATRNL1 increases acid-sensing ion channel 1 to advance epithelial-mesenchymal transition in endometriosis by binding to microRNA-103a-3p,"Chen X, Liu M.",Reprod Biol. 2022 Jun;22(2):100643. doi: 10.1016/j.repbio.2022.100643. Epub 2022 Apr 30.,Chen X,Reprod Biol,2022,2022/5/3,,,10.1016/j.repbio.2022.100643
35476352,Inflammatory MicroRNAs and the Pathophysiology of Endometriosis and Atherosclerosis: Common Pathways and Future Directions Towards Elucidating the Relationship,"Azari ZD, Aljubran F, Nothnick WB.",Reprod Sci. 2022 Aug;29(8):2089-2104. doi: 10.1007/s43032-022-00955-6. Epub 2022 Apr 27.,Azari ZD,Reprod Sci,2022,2022/4/27,,,10.1007/s43032-022-00955-6
